{
  "schemaVersion": 1,
  "name": "edge-wasi",
  "backends": [
    "wasm"
  ],
  "capabilities": [
    "clock",
    "random",
    "net.client",
    "net.server",
    "fs.read",
    "fs.write",
    "heap",
    "gc"
  ],
  "notes": "Potential host upper bounds only; never grants; host-conditional features require explicit verification"
}
