{
  "schemaVersion": 1,
  "name": "embedded",
  "backends": [
    "llvm",
    "c",
    "bytecode"
  ],
  "capabilities": [
    "clock",
    "random",
    "fs.read",
    "fs.write",
    "device.gpio",
    "heap"
  ],
  "notes": "Potential host upper bounds only; never grants; host-conditional features require explicit verification"
}
